{
  "version": "1.0.0",
  "updated": "2025-11-01T00:00:00Z",
  "description": "Threat Actor Profiles and Attribution Data - Real-world APT groups and cybercrime organizations",
  "threatActors": [
    {
      "id": "TA-001",
      "name": "APT28",
      "aliases": ["Fancy Bear", "Sofacy", "Sednit", "Pawn Storm", "STRONTIUM", "Tsar Team"],
      "type": "nation-state",
      "country": "Russia",
      "motivation": ["espionage", "disruption"],
      "firstSeen": "2007-01-01",
      "lastSeen": "2024-10-15",
      "status": "active",
      "sophistication": "advanced",
      "targets": {
        "industries": ["Government", "Military", "Defense", "Media", "Energy"],
        "countries": ["United States", "Ukraine", "Georgia", "France", "Germany", "NATO members"],
        "sectors": ["Political organizations", "Think tanks", "NGOs"]
      },
      "ttps": [
        { "id": "T1566.001", "name": "Spearphishing Attachment" },
        { "id": "T1059.001", "name": "PowerShell" },
        { "id": "T1071.001", "name": "Web Protocols" },
        { "id": "T1027", "name": "Obfuscated Files or Information" },
        { "id": "T1055", "name": "Process Injection" },
        { "id": "T1083", "name": "File and Directory Discovery" },
        { "id": "T1003", "name": "OS Credential Dumping" }
      ],
      "malwareFamilies": ["X-Agent", "Sofacy", "Komplex", "XTunnel", "CHOPSTICK", "Zebrocy"],
      "infrastructure": {
        "domains": ["sofacy-news.com", "sednit-update.com", "fancy-bear.net"],
        "ips": ["185.86.148.227", "185.25.51.198", "193.169.245.78"],
        "asns": ["AS44050", "AS197695"]
      },
      "campaigns": [
        {
          "name": "DNC Hack",
          "date": "2016-06-01",
          "description": "Compromise of Democratic National Committee servers",
          "targets": ["Democratic National Committee", "Clinton Campaign"]
        },
        {
          "name": "Olympic Destroyer",
          "date": "2018-02-09",
          "description": "Attack on 2018 Winter Olympics infrastructure",
          "targets": ["PyeongChang Olympics"]
        },
        {
          "name": "Ukraine Power Grid",
          "date": "2015-12-23",
          "description": "Attacks on Ukrainian critical infrastructure",
          "targets": ["Ukrainian Power Companies"]
        }
      ],
      "attribution": {
        "confidence": "very-high",
        "evidence": [
          "Russian language artifacts in malware",
          "Operational hours align with Moscow timezone",
          "Targets align with Russian geopolitical interests",
          "Infrastructure hosted in Russia",
          "Code reuse across campaigns"
        ]
      },
      "references": [
        {
          "title": "APT28: A Window Into Russia's Cyber Espionage Operations",
          "url": "https://www.fireeye.com/content/dam/fireeye-www/global/en/current-threats/pdfs/rpt-apt28.pdf",
          "date": "2014-10-27"
        }
      ]
    },
    {
      "id": "TA-002",
      "name": "APT29",
      "aliases": ["Cozy Bear", "The Dukes", "CozyDuke", "YTTRIUM", "NOBELIUM"],
      "type": "nation-state",
      "country": "Russia",
      "motivation": ["espionage"],
      "firstSeen": "2008-01-01",
      "lastSeen": "2024-09-20",
      "status": "active",
      "sophistication": "advanced",
      "targets": {
        "industries": ["Government", "Technology", "Healthcare", "Energy", "Research"],
        "countries": ["United States", "United Kingdom", "European Union", "NATO members"],
        "sectors": ["Think tanks", "Universities", "Pharmaceutical companies"]
      },
      "ttps": [
        { "id": "T1566.002", "name": "Spearphishing Link" },
        { "id": "T1195.002", "name": "Compromise Software Supply Chain" },
        { "id": "T1078", "name": "Valid Accounts" },
        { "id": "T1550.001", "name": "Application Access Token" },
        { "id": "T1114.002", "name": "Remote Email Collection" },
        { "id": "T1087", "name": "Account Discovery" },
        { "id": "T1213", "name": "Data from Information Repositories" }
      ],
      "malwareFamilies": ["CozyDuke", "MiniDuke", "SeaDuke", "HammerDuke", "CloudDuke", "SUNBURST"],
      "infrastructure": {
        "domains": ["cozy-bear.com", "nobelium-update.net", "solarwinds-cdn.com"],
        "ips": ["13.59.205.66", "54.193.127.66", "34.203.203.23"],
        "asns": ["AS16509", "AS14618"]
      },
      "campaigns": [
        {
          "name": "SolarWinds Supply Chain Attack",
          "date": "2020-03-01",
          "description": "Compromise of SolarWinds Orion platform affecting thousands of organizations",
          "targets": ["SolarWinds", "US Government agencies", "Fortune 500 companies"]
        },
        {
          "name": "COVID-19 Vaccine Research Targeting",
          "date": "2020-07-16",
          "description": "Targeting organizations involved in COVID-19 vaccine development",
          "targets": ["Pharmaceutical companies", "Research institutions"]
        }
      ],
      "attribution": {
        "confidence": "very-high",
        "evidence": [
          "Advanced tradecraft consistent with state-sponsored operations",
          "Targets align with Russian intelligence priorities",
          "Long-term persistent access operations",
          "Use of zero-day exploits",
          "Sophisticated supply chain compromise"
        ]
      },
      "references": [
        {
          "title": "Highly Evasive Attacker Leverages SolarWinds Supply Chain",
          "url": "https://www.fireeye.com/blog/threat-research/2020/12/evasive-attacker-leverages-solarwinds-supply-chain.html",
          "date": "2020-12-13"
        }
      ]
    },
    {
      "id": "TA-003",
      "name": "Lazarus Group",
      "aliases": ["HIDDEN COBRA", "Guardians of Peace", "ZINC", "APT38"],
      "type": "nation-state",
      "country": "North Korea",
      "motivation": ["financial", "espionage", "disruption"],
      "firstSeen": "2009-01-01",
      "lastSeen": "2024-10-01",
      "status": "active",
      "sophistication": "advanced",
      "targets": {
        "industries": [
          "Financial Services",
          "Cryptocurrency",
          "Entertainment",
          "Defense",
          "Government"
        ],
        "countries": ["United States", "South Korea", "Bangladesh", "Global"],
        "sectors": ["Banks", "Cryptocurrency exchanges", "Media companies"]
      },
      "ttps": [
        { "id": "T1566.001", "name": "Spearphishing Attachment" },
        { "id": "T1204.002", "name": "Malicious File" },
        { "id": "T1486", "name": "Data Encrypted for Impact" },
        { "id": "T1490", "name": "Inhibit System Recovery" },
        { "id": "T1078", "name": "Valid Accounts" },
        { "id": "T1021.001", "name": "Remote Desktop Protocol" },
        { "id": "T1047", "name": "Windows Management Instrumentation" }
      ],
      "malwareFamilies": [
        "WannaCry",
        "HOPLIGHT",
        "ELECTRICFISH",
        "BADCALL",
        "HARDRAIN",
        "AppleJeus"
      ],
      "infrastructure": {
        "domains": ["lazarus-group.net", "wannacry-update.com", "crypto-exchange.biz"],
        "ips": ["175.45.178.234", "210.122.7.129", "31.28.162.37"],
        "asns": ["AS131279", "AS38631"]
      },
      "campaigns": [
        {
          "name": "WannaCry Ransomware",
          "date": "2017-05-12",
          "description": "Global ransomware outbreak affecting 200,000+ computers",
          "targets": ["Healthcare", "Telecommunications", "Government"]
        },
        {
          "name": "Bangladesh Bank Heist",
          "date": "2016-02-05",
          "description": "Attempted theft of $951 million from Bangladesh Central Bank",
          "targets": ["Bangladesh Bank", "SWIFT network"]
        },
        {
          "name": "Sony Pictures Hack",
          "date": "2014-11-24",
          "description": "Destructive attack on Sony Pictures Entertainment",
          "targets": ["Sony Pictures Entertainment"]
        }
      ],
      "attribution": {
        "confidence": "very-high",
        "evidence": [
          "Korean language artifacts",
          "Operational hours align with Pyongyang timezone",
          "Financial motivation consistent with North Korean sanctions evasion",
          "Code reuse across campaigns",
          "Infrastructure in North Korea"
        ]
      },
      "references": [
        {
          "title": "HIDDEN COBRA - North Korean Malicious Cyber Activity",
          "url": "https://www.us-cert.gov/ncas/alerts/TA17-164A",
          "date": "2017-06-13"
        }
      ]
    },
    {
      "id": "TA-004",
      "name": "APT41",
      "aliases": ["Winnti", "Barium", "Wicked Panda", "Double Dragon"],
      "type": "nation-state",
      "country": "China",
      "motivation": ["espionage", "financial"],
      "firstSeen": "2012-01-01",
      "lastSeen": "2024-08-15",
      "status": "active",
      "sophistication": "advanced",
      "targets": {
        "industries": ["Technology", "Gaming", "Healthcare", "Telecommunications", "Education"],
        "countries": ["United States", "Japan", "Taiwan", "Hong Kong", "Global"],
        "sectors": ["Software companies", "Video game companies", "Universities"]
      },
      "ttps": [
        { "id": "T1195.002", "name": "Compromise Software Supply Chain" },
        { "id": "T1078", "name": "Valid Accounts" },
        { "id": "T1505.003", "name": "Web Shell" },
        { "id": "T1190", "name": "Exploit Public-Facing Application" },
        { "id": "T1027", "name": "Obfuscated Files or Information" },
        { "id": "T1070.004", "name": "File Deletion" },
        { "id": "T1036", "name": "Masquerading" }
      ],
      "malwareFamilies": ["Winnti", "HIGHNOON", "POISONPLUG", "SHADOWPAD", "CROSSWALK"],
      "infrastructure": {
        "domains": ["winnti-update.com", "apt41-cdn.net", "gaming-patch.org"],
        "ips": ["103.85.24.155", "45.77.179.176", "149.28.84.98"],
        "asns": ["AS4134", "AS4837"]